{
  "schemaVersion": "defracto.conveyor-lane-receipt.v1",
  "receiptKey": "{runKey}.02-author-canonical-spec.receipt",
  "laneKey": "defracto.lanes.02-author-canonical-spec.v1",
  "status": "blocked",
  "checkedAt": "{checkedAt}",
  "inputArtifacts": [],
  "outputArtifacts": [],
  "workerResponse": {
    "workerKey": "defracto.workers.gemini_flash.v1",
    "responsePath": "{runPath}/lanes/02-author-canonical-spec/response.gemini-flash.v1.json"
  },
  "hashes": [],
  "findings": [
    {
      "findingKey": "receipt_template_not_executed",
      "status": "blocked",
      "message": "This template must be replaced by a live lane receipt."
    }
  ],
  "nextLane": "03-author-semantic-contract"
}
